{
  "$schema": "https://json-schema.org/draft/2020-12/schema",
  "$id": "https://sentinelmesh.local/schemas/vulnerability-import.schema.json",
  "title": "SentinelMesh Vulnerability Import",
  "type": "object",
  "required": ["source", "imported_at", "findings"],
  "properties": {
    "source": { "type": "string" },
    "scanner": { "type": "string" },
    "imported_at": { "type": "string" },
    "findings": {
      "type": "array",
      "items": {
        "type": "object",
        "required": ["asset", "id", "severity"],
        "properties": {
          "asset": {
            "type": "object",
            "properties": {
              "ip": { "type": "string" },
              "hostname": { "type": "string" },
              "mac": { "type": "string" }
            }
          },
          "id": { "type": "string" },
          "title": { "type": "string" },
          "severity": { "type": "string" },
          "cvss": { "type": "number" },
          "port": { "type": "integer" },
          "protocol": { "type": "string" },
          "status": { "type": "string" },
          "evidence": { "type": "string" }
        }
      }
    }
  }
}
