{
  "source": "sample",
  "scanner": "manual-seed",
  "imported_at": "2026-05-02T00:00:00Z",
  "findings": [
    {
      "asset": {
        "ip": "192.168.56.10",
        "hostname": "range-dc-01"
      },
      "id": "CVE-EXAMPLE-0001",
      "title": "Example critical service vulnerability",
      "severity": "critical",
      "cvss": 9.8,
      "port": 445,
      "protocol": "tcp",
      "status": "open",
      "evidence": "Synthetic vulnerability used for range and pipeline validation."
    }
  ]
}
